"Column";"de";"en";"fr";"pt";"ru";"es";"it";"da";"sv";"nl";"pl";"fi";"pt-BR";"tr";"bg";"cs";"el";"hu";"no";"ro";"es-419";"uk";"ar";"zh-CN";"zh-TW";"ja";"ko";"th";"vn"
"collection_nav_ecblack";"Schwarze Legion";"Black Legion";"Légion noire";"Legião Negra";"Чёрный легион";"Legión Negra";"Legione Nera";"Sort Legion";"";"Zwarte Legioen";"Czarny Legion";"Musta legioona";"Legião Negra";"Siyah Lejyon";"Черен Легион";"Černá Legie";"Μαύρη Λεγεώνα";"Sötét Légió";"Svart Legion";"Legiunea Neagră";"";"Чорний Легіон";"الفيلق الاسود";"黑色军团";"黑色軍團";"";"흑색 군단";"พันธมิตรสีดำ";""
"collection_nav_ecgreen";"Grüne Legion";"Green Legion";"Légion verte";"Legião Verde";"Зелёный легион";"Legión Verde";"Legione Verde";"Grøn Legion";"";"Groene Legioen";"Zielony Legion";"Vihreä legioona";"Legião Verde";"Yeşil Lejyon";"Зелен Легион";"Zelená Legie";"Πράσινη Λεγεώνα";"Zöld Légió";"Grønn Legion";"Legiunea Verde";"";"Зелений Легіон";"الفيلق الاخضر";"绿色军团";"綠色軍團";"";"녹색 군단";"พันธมิตรสีเขียว";""
"collection_nav_ecwhite";"Weiße Legion";"White Legion";"Légion blanche";"Legião Branca";"Белый легион";"Legión Blanca";"Legione Bianca";"Hvid Legion";"";"Witte legioen";"Biały Legion";"Valkoinen legioona";"Legião Branca";"Beyaz Lejyon";"Бял Легион";"Bílá Legie";"Λευκή Λεγεώνα";"Fehér Légió";"Hvit Legion";"Legiunea Albă";"";"Білий Легіон";"الفيلق الأبيض";"白色军团";"白色軍團";"";"백색 군단";"พันธมิตรสีขาว";""
"collection_nav_ecblue";"Blaue Legion";"Blue Legion";"Légion bleue";"Legião Azul";"Синий легион";"Legión Azul";"Legione Blu";"Blå Legion";"";"Blauwe Legioen";"Niebieski Legion";"Sininen legioona";"Legião Azul";"Mavi Lejyon";"Син Легион";"Modrá Legie";"Μπλε Λεγεώνα";"Kék Légió";"Blå Legion";"Legiunea Albastră";"";"Синій Легіон";"الفيلق الأزرق";"蓝色军团";"藍色軍團";"";"청색 군단";"พันธมิตรสีน้ำเงิน";""
"collection_quest_block_hint";"Schalte alle benötigten Karten frei, um Fortschritt bei dieser Quest zu machen.";"Unlock all required cards to progress this quest.";"Déverrouillez toutes les cartes nécessaires pour progresser dans cette quête.";"Desbloqueia todas as cartas necessárias para progredires esta missão.";"Разблокируйте все необходимые карты, чтобы выполнить этот квест.";"Desbloquea todas las cartas requeridas para avanzar en esta misión.";"Sblocca tutte le carte richieste per progredire in questa missione.";"Lås op for de krævede kort, for at fortsætte dette quest.";"";"";"Odblokuj wszystkie karty aby kontynuować zadanie.";"Avaa kaikki tarvittavat kortit edistyäksesi tässä tehtävässä.";"Desbloqueie todos os requerimentos para progredir nesta missão.";"Bu görevi tamamlamak için gerekli tüm kartları aç.";"";"Odemkni všechny vyžadované karty pro postup v tomto úkolu.";"Ξεκλείδωσε όλες τις απαιτούμενες κάρτες για να προχωρήσεις σ' αυτήν την αποστολή.";"Oldd fel az összes szükséges kártyát, hogy meg tudd csinálni ezt a küldetést.";"Lås opp alle nødvendige kort for å projisere dette oppdraget.";"Deblocați toate cărțile necesare pentru a progresa in misiuni.";"";"Розблокуйте всі необхідні карти, щоб виконати цей квест.";"افتح جميع البطاقات للتقدم بهذه المهمة";"请先解锁所有必须的卡牌才能进行此任务。";"請先解鎖所有必須的卡片才能進行此任務。";"";"이 퀘스트를 진행하기 위해서는 필요한 모든 카드를 잠금 해제해야 합니다.";"ปลดล็อคการ์ดทั้งหมดเพื่อที่จะดำเนินการภารกิจนี้";""
"collection_requirements_caption";"Freischaltquests";"Unlock Quests";"Quêtes de déverrouillage";"Desbloqueia Missões";"Открой Квесты";"Desbloquea misiones";"Sblocca le missioni";"Lås op for Quests";"";"";"Zadanie: Odblokowano sklep";"Kaupan avaustehtävät";"Missões para desbloqueio da Loja";"Dükkan Görevi";"";"Odemkni Úkoly";"Ξεκλείδωσε Αποστολές";"Oldd fel a küldetéseket";"Lås opp oppdrag";"Deblochează misiuni";"";"Виконати квести для розблокування:";"فتح المهام";"解锁任务";"解鎖任務";"";"퀘스트 잠금 해제하기";"ปลดล็อคภารกิจ";""
"collection_nav_eccolorless";"Kristall-Legion";"Crystal Legion";"Légion de cristal";"Legião de Cristal";"Кристальный легион";"Legión de Cristal";"Legione di Cristallo";"Krystal Legion";"";"";"Kryształowy Legion";"";"Legião de Cristal";"Kristal Lejyon";"Кристален Легион";"Legie Krystalů";"Λεγεώνα του Κρυστάλλου";"Kristály Légió";"Krystall Legion";"Legiunea de cristal";"";"Кришталевий Легіон";"الفيلق الكرستالي";"水晶军团";"水晶軍團";"";"수정 군단";"พันธมิตรแห่งคริสตัล";""
"collection_hint_golems";"Alle Karten der Kristall-Legion können in jedem Deck ohne Beachtung der Farbbeschränkung genutzt werden.";"All cards of the crystal legion can be put in any deck without regarding the color restrictions.";"Toutes les cartes de la légion de cristal peuvent être mises dans n'importe quel deck sans tenir compte de la restriction de couleur.";"Qualquer carta da Legião de Cristal pode ser usada em qualquer baralho sem ter de respeitar a restrição de cores.";"Все карты кристального легиона можно поставить в любую колоду без учета цветовых ограничений.";"Todas las tarjetas de la legión de cristal se pueden poner en cualquier mazo sin tener en cuenta las restricciones de color.";"Tutte le carte della legione di cristallo possono essere messe in qualsiasi mazzo senza restrizioni sul colore.";"Alle kort fra Krystal Legionen kan tilføjes til Decks uden hensyn til farverestriktionerne.";"";"";"Wszystkie karty kryształowego legionu można umieścić w dowolnej talii bez względu na ograniczenia kolorów.";"";"Todas as cartas da legião de cristal podem ser colocadas em qualquer deck independente das restrições de cor.";"Kristal lejyonun kartları renk sınırlamasına takılmadan herhangi bir destede kullanılabilir.";"Всички карти на кристалният легион могат да бъдат сложени в което и да е тесте игнорирайки ограничение на цвят.";"Všechny karty legie krystalů, lze vložit do libovolného balíčku, nevztahuje se na ně omezení barev.";"Όλες οι κάρτες της κρυστάλλινης λεγεώνας μπορούν να μπουν σε οποιαδήποτε τράπουλα χωρίς να λαμβάνονται υπόψη οι περιορισμοί χρώματος.";"Minden kártya a Kristály Légióból használható bármilyen pakliban anélkül, hogy korlátozná a maximális színszámot.";"Alle kort av crystal legion kan bli satt i noen dekk uten angående farge begrensninger.";"Toate cărțile legiunii de cristal pot fi introduse în orice punte, fără a ține cont de restricțiile de culoare.";"";"Всі карти кришталевого легіону можна помістити в будь-яку колоду без обмежень кольору.";"من الممكن وضع بطاقات الفيلق الكرستالي باي دستة بغض النظر عن اللون";"所有水晶军团的卡牌都可以被随意加入牌组，而不需要担心牌組內只能有两种颜色卡牌的限制。";"所有水晶軍團的卡牌都可以被隨意加入牌組，而不需要擔心牌組內只能有兩種顏色卡牌的限制。";"";"수정 군단의 모든 카드는 색상 제한 없이 모든 덱에 넣을 수 있습니다.";"การ์ดทั้งหมดของพันธมิตรแห่งคริสตัลสามารถใส่ในเด็คใดก็ได้โดยไม่ต้องคำนึงถึงสีต่างๆ";""
