"Column";"de";"en";"fr";"pt";"ru";"es";"it";"da";"sv";"nl";"pl";"fi";"pt-BR";"tr";"bg";"cs";"el";"hu";"no";"ro";"es-419";"uk";"ar";"zh-CN";"zh-TW";"ja";"ko";"th";"vn"
"home_translation_text";"Klicke hier, um uns bei der Übersetzung des Spiels zu unterstützen";"Click here to help us translate the game";"Cliquez ici pour nous aider à traduire le jeu";"Clique aqui para ajudar-nos a traduzir o jogo";"Нажмите сюда, чтобы помочь нам перевести игру";"Click aquí para ayudarnos a traducir el juego";"Clicca qui per aiutarci a tradurre il gioco";"Klik her for at hjælpe med at oversætte spillet";"Klicka här för att hjälpa oss att översätta spelet";"Klik hier om ons te helpen Rise of Legions te vertalen";"Kliknij tutaj, aby pomóc w tłumaczeniu gry";"Klikkaa tästä auttaaksesi pelin kääntämisessä";"Clique aqui para ajudar-nos a traduzir o jogo";"Oyunun çevirisinde yardımcı olmak için buraya tıkla";"Щракнете тук, за да ни помогнете с превод на играта";"Klikni zde pro pomoc s překladem hry";"Κλίκαρε εδώ για να μας βοηθήσεις να μεταφράσουμε το παιχνίδι";"Kattintson ide, hogy segítsen lefordítani a játékot";"";"Faceți clic aici pentru a ne ajuta să traducem jocul";"Haz clic aquí para ayudarnos a traducir el juego";"Натисніть тут, щоб допомогти нам перекласти гру";"اضغط هنا لمساعدتنا في ترجمة اللعبة";"请点击此处帮助我们完善此游戏的语系翻译";"請點擊此處幫助我們完善此遊戲的語系翻譯";"";"게임 번역을 도우려면 여기를 클릭하세요";"";""
"home_scill_text";"Klicke hier, um mehr Quests, Achievements und Belohnungen zu bekommen";"Click here to receive even more quests, achievements and rewards";"Cliquez ici pour recevoir encore plus de quêtes, d'accomplissements et de récompenses";"Clica aqui para receberes ainda mais missões, conquistas e recompensas";"Нажмите здесь для получения еще большего количества заданий, достижений и наград";"Haz clic aquí para recibir aún más misiones, logros y recompensas.";"Clicca qui per ricevere ancora più missioni, obiettivi e ricompense";"Klik her for at modtage endnu flere opgaver, bedrifter og belønninger";"Klicka här för att få ännu fler uppdrag, prestationer och belöningar";"";"Kliknij tutaj aby otrzymać jeszcze więcej zadań, osiągnięć i nagród";"";"Clique aqui para receber ainda mais missões, conquistas e recompensas";"Daha fazla görev, başarım ve ödüller almak için buraya tıkla";"Кликнете тук, за да получите още повече търсения, постижения и награди";"Kliknutím sem získáte ještě více úkolů, úspěchů a odměn";"Κλίκαρε εδώ, για να λαμβάνεις ακόμη περισσότερες αποστολές, επιτεύγματα και ανταμοιβές";"Kattints ide további küldetésekért, eredményeket és jutalmakért";"";"Faceți clic aici pentru a primi și mai multe misiuni, realizări și recompense";"Haz clic aquí para recibir aún más misiones, logros y recompensas.";"Натисніть тут для отримання ще більшої кількості завдань, досягнень і нагород";"اضغط هنا للحصول على المزيد من المهام و الإنجازات و المكافآت";"请点击此处能获得更多任务、成就与奖赏。";"請點擊此處能收到更多任務、成就與獎賞。";"";"더 많은 퀘스트, 도전 과제 및 보상을 받으려면 여기를 클릭하세요";"";""
"home_discord_text";"Klicke hier, um unserem Discord-Server beizutreten";"Click here to join our Discord server";"Cliquez ici pour rejoindre notre serveur Discord";"Clique aqui para juntares-te ao nosso servidor no Discord";"Нажмите сюда, чтобы присоединиться к нашему серверу Discord";"Click aquí para unirte a nuestro Discord";"Clicca qui per unirti al nostro server Discord";"Klik her for at slutte dig til vores Discord-server";"Klicka här för att gå med i vår Discord-server";"Klik hier om onze Discord server toe te treden";"Kliknij tutaj, aby dołączyć do naszego serwera Discord";"Klikkaa tästä liittyäksesi Discord-palvelimellemme";"Clique aqui para se juntar ao nosso servidor no Discord";"Discord sunucumuza katılmak için buraya tıkla";"Кликнете тук, за да се присъедините към нашия Discord сървър";"Klikni sem pro připojení na náš Discord server";"Κλίκαρε εδώ για να γίνεις μέλος στο διακομιστή μας στο Discord";"";"";"Faceți clic aici pentru a vă alătura serverului nostru de Discord";"Haz clic aquí para unirte a nuestro servidor de Discord";"Натисніть тут, щоб приєднатися до нашого сервера Discord";"";"请点击此处加入我们的 Discord 伺服频道";"請點擊此處加入我們的 Discord 伺服頻道";"";"Discord(디스코드) 서버에 가입하려면 여기를 클릭하세요";"";""
"home_social_text";"Folge uns in den sozialen Medien";"Follow us on social media";"Suivez-nous sur les réseaux sociaux";"Segue-nos nas redes sociais";"Следите за нами в социальных сетях";"Síguenos en las redes sociales";"Seguici sui Social";"Følg os på de sociale medier";"Följ oss på sociala medier";"Volg ons op social media";"Śledź nas w mediach społecznościowych";"Seuraa meitä sosiaalisessa mediassa";"Siga-nos nas redes sociais";"Bizi sosyal medya'da takip edin";"Следвайте ни в социалните мрежи";"Sleduj nás na sociálních sítích";"Ακολούθησέ μας στα μέσα κοινωνικής δικτύωσης";"Kövess a közösségi oldalainkon";"";"Urmăriți-ne pe Social Media";"Síguenos en las redes sociales";"Слідкуйте за нами в соціальних мережах";"تابعنا على وسائل التواصل الإجتماعي";"在社交媒体上关注我们";"在社群媒體上跟隨我們";"";"소셜 미디어에서 팔로우하기";"";""
"home_wiki_text";"Klicke hier, um zum Rise of Legions Wiki zu gelangen";"Click here to read the Rise of Legions Wiki";"Cliquez ici pour lire le Wiki de Rise of Legions";"Clica aqui para ler a Wiki de Rise of Legions";"Нажмите сюда, чтобы прочитать Wiki-страницу игры Rise of Legions";"Click aquí para leer la Wiki de Rise of Legions";"Clicca qui per leggere la Wiki di Rise of Legions";"Klik her for at læse Rise of Legions Wiki";"Klicka här för att läsa Rise of Legions Wiki";"Klik hier om de Rise of Legions Wiki te lezen";"Kliknij tutaj aby wejść na Wiki Rise of Legions";"Klikkaa tästä Rise of Legionsin wikiin";"Cliqua aqui para ler o Wiki do Rise of Legions";"Rise of Legions Yardım sayfasına gitmek için buraya tıkla";"Кликнете тук, за да прочетете Rise of Legions Wiki";"Klikni sem pro Rise of Legions Wiki";"Κλίκαρε εδώ για να διαβάσεις το Βίκι του παιχνιδιού";"Kattintson ide a Rise of Légiók Wiki-hez";"";"Click aici pentru a citi Rise of Legions Wiki";"Haz clic aquí para leer el Wiki de Rise of Legions ";"Клацніть тут, щоб прочитати Wiki Rise of Legions";"";"请点击此处读取 Rise of Legions 的 Wiki";"請點擊此處讀取 Rise of Legions 的 Wiki";"";"Rise of Legions 위키를 읽으려면 여기를 클릭하세요";"";""
"home_patch_notes_title";"Patchnotizen vom";"Patch Notes from";"Notes de mise à jour du";"Notas do Patch de";"Примечания к патчу от";"Notas de parche del";"Note sulla patch del";"Patch noter fra";"Uppdaterings information från";"Patch Notes van";"Informacje z poprawki z dnia";"Viimeisin päivitys:";"Notas de atualizações de";"Yama Notları";"Списъци с Поправки";"Seznam změn od";"Σημειώσεις Ενημέρωσης από";"";"";"Ultimile Actualizări din";"Notas del parche desde";"Патч-примітки від";"";"补丁说明，由";"修補說明，由";"";"패치 노트";"";""
"home_patch_notes_text";"Klicke hier, um die neuesten Patchnotizen zu lesen";"Click here to read the latest patch notes";"Cliquez ici pour lire les dernières notes de mise à jour";"Clica aqui para ler as últimas notas do patch";"Нажмите сюда, чтобы прочитать последние примечания к патчу";"Click aquí para leer las últimas notas de parche.";"Clicca qui per leggere le ultime note sulla patch";"Klik her for at læse de seneste patch noter";"Klicka här för att läsa de senaste uppdateringarna";"Klik hier om de meest recente patch notes te lezen";"Kliknij tutaj, aby przeczytać najnowsze informacje o zmianach";"Klikkaa tästä nähdäksesi pelin viimeisimmät päivitykset";"Clique aqui para ler a ultimas notas das atualizações";"Yama notlarını okumak için buraya tıkla";"Кликнете тук, за да прочетете последните Списъци с Поправки";"Klikni sem pro zobrazení posledních změn";"Κλίκαρε εδώ για να διαβάσεις τις πιο πρόσφατες σημειώσεις ενημέρωσης";"";"";"Faceți clic aici pentru a citi ultimele actualizări";"Haz clic aquí para leer las últimas notas del parche";"Натисніть тут, щоб прочитати останні замітки про виправлення";"";"请点击此处读取最新的补丁说明";"請點擊此處讀取最新的修補說明";"";"최신 패치 노트를 읽으려면 여기를 클릭하세요";"";""
"home_tournament_title";"Community Tournament";"Community Tournament";"Tournoi Communautaire";"Torneio Comunitário";"Турнир Сообщества";"Torneo Comunitario";"Torneo della Community";"Fællesskabsturnering";"Gemenskapsturnering";"";"Turniej Społeczności";"";"Torneio da Comunidade";"Topluluk Turnuvası";"Обществени турнири";"Komunitní turnaje";"Τουρνουά της Κοινότητας";"";"";"Turnee Comunitate";"Torneo Comunitario";"Турнір Спільноти";"";"社区比赛";"社區比賽";"";"커뮤니티 토너먼트";"";""
"home_tournament_text";"Klicke hier, um dich zum kommenden Community Tournament zu informieren";"Click here to read about the upcoming community tournament";"Cliquez ici pour en savoir plus sur le prochain tournoi communautaire";"Clique aqui para ler sobre o próximo Torneio Comunitário";"Нажмите здесь для получения информации о грядущем турнире сообщества";"Haga clic aquí para leer sobre el próximo torneo comunitario.";"Clicca qui per saperne di più sul prossimo torneo della community";"Klik her for at læse om den kommende fællesskabsturnering";"Klicka här för att läsa om den kommande gemenskapsturneringen";"";"Naciśnij tutaj aby przeczytać o nadchodzącym turnieju społeczności";"";"Clique aqui para ler sobre o próximo Torneio da Comunidade";"Yaklaşan topluluk turnuvası hakkında okumak için buraya tıkla";"Кликнете тук, за да прочетете за предстоящи общ турнир";"Klikněte zde pro informace o nadcházejícím komunitním turnaji";"Κλίκαρε εδώ, για να διαβάσεις για το επερχόμενο τουρνουά της κοινότητας";"";"";"Faceți clic aici pentru a citi despre turneul comunității care urmează";"Haz clic aquí para leer sobre el próximo torneo comunitario";"Натисніть тут для отримання інформації про майбутній турнір спільноти";"";"请点击此处读取即将举办社区比赛的讯息";"請點擊此處讀取即將舉辦社區比賽的訊息";"";"다가오는 커뮤니티 토너먼트에 관해 읽으려면 여기를 클릭하세요";"";""
"home_guide_title";"Rise of Legions Guide";"Rise of Legions Guide";"Guide de Rise of Legions";"Guia Rise of Legions";"Руководство Rise of Legions";"Guia Rise of Legion";"Guida a Rise of Legions";"Rise of Legions Guide";"Rise of Legions Guide";"";"Poradnik Rise of Legions";"Rise of Legions -opas";"Guia de Rise of Legions";"Rise Of Legions Rehber";"Rise of Legions ръководство";"Rise of Legions Průvodce";"Οδηγός τού Rise of Legions";"Rise of Legions útmutató";"";"Ghidul joculiu Rise of Legions";"Guía de Rise of Legions";"Керівництво до Rise of Legions";"";"Rise of Legions 指南";"Rise of Legions 指南";"";"Rise of Legions 안내서";"";""
"home_guide_text";"Klicke hier, um einen Guide für den Einstieg ins Spiel zu lesen";"Click here to read a guide on how to get started";"Cliquez ici pour lire un guide sur comment débuter";"Clique aqui para ler um guia de como começar a jogar";"Нажмите здесь, чтобы прочитать руководство о том, как начать играть";"Clic aquí para leer una guía de como empezar";"Clicca qui per leggere una guida introduttiva";"Klik her for at læse en guide om hvordan du kommer i gang";"Klicka här föra tt läsa en guide om hur du startar";"";"Kliknij tutaj, aby przeczytać poradnik jak rozpocząć";"Klikkaa tästä lukeaksesi oppaan, jolla pääset alkuun";"Clique aqui para ler um guia sobre como dar seus primeiros passos";"Başlangıç rehberini okumak için buraya tıklayınız";"Кликнете тук, за да прочетете ръководството за това как да започнете";"Klikni sem pro průvodce jak začít";"Κλίκαρε εδώ για να διαβάσεις έναν οδηγό για το πώς να ξεκινήσεις";"";"";"Faceți clic aici pentru a citi un ghid despre cum să începeți";"Haz clic aquí para leer una guía sobre cómo empezar";"Натисніть тут, щоб прочитати керівництво про те, як почати";"";"请点击此处读取有关如何开始游玩";"請點擊此處讀取有關如何開始遊玩";"";"시작 방법에 대한 안내서를 읽으려면 여기를 클릭하세요";"";""
"home_box_title";"Willkommen in Rise of Legions!";"Welcome to Rise of Legions!";"Bienvenu à Rise of Legions!";"Bem-vindo ao Rise of Legions!";"Добро пожаловать в Rise of Legions!";"¡Bienvenido a Rise of Legions!";"Benvenuti in Rise of Legions!";"Velkommen til Rise of Legions!";"Välkommen till Rise of Legions!";"Welkom in Rise of Legions!";"Witaj w Rise of Legions!";"Tervetuloa Rise of Legionsiin!";"Bem-vindo ao Rise of Legions!";"Rise of Legions'a hoş geldiniz!";"Добре дошли в ""Rise of Legions""!";"Vítejte ve hře Rise of Legions!";"Καλωσήλθες στο Rise of Legions!";"Üdvözlünk a Rise of Legions-ben!";"";"Bine aţi venit la Rise of Legions!";"¡Bienvenido a Rise of Legions!";"Ласкаво просимо в Rise of Legions!";"مرحبا بك في رايز اوف ليجينز!";"欢迎来到 Rise of Legions！";"歡迎來到 Rise of Legions！";"";"Rise of Legions에 오신 것을 환영합니다!";"ยินดีต้อนรับสู่ Rise of Legion!";""
"home_box_text";"Wenn du irgendwelche Probleme oder Feedback hast, bitte nutze den ""Feedback""-Button im Schließen-Dialog. Wir schauen uns jede Nachricht an und entwickeln Rise of Legions entsprechend der Meinung der Community weiter!";"If you have any problems or feedback, please use the ""Feedback"" button at the close dialog. We are listening closely and will improve Rise of Legions based on what our community wants most!";"Si vous avez des problèmes ou des commentaires, s'il vous plaît utilisez le bouton ""Commentaires"" lors de la fermeture du jeu. Nous écoutons attentivement et allons améliorer Rise of Legions basé sur ce que la communauté désire le plus!";"Se tiveres algum problema ou feedback, usa o botão ""Feedback"" na caixa de diálogo Fechar. Estamos a ouvir a comunidade atentamente e melhoraremos o Rise of Legions com base no Feedback da comunidade!";"Если у вас есть проблемы или пожелания, пожалуйста, воспользуйтесь кнопкой ""Отзыв"" в диалоге закрытия игры. Мы внимательно выслушаем и улучшим Rise of Legions, основываясь на пожеланиях нашего сообщества!";"Si tiene algún problema o comentario, utilice el botón ""Comentarios"" en el cuadro de diálogo de cierre. ¡Escuchamos atentamente y mejoraremos Rise of Legions en función de lo que nuestra comunidad más desea!";"Se hai un qualsiasi problema o suggerimento, usa pure il bottone ""Feedback"". Ascoltiamo attentamente e siamo intenzionati a migliorare Rise of Legions in base a ciò a cui la nostra community importa di più!";"Hvis du har nogle problemer eller noget feedback, brug venligst ""Feedback""-knappen ved den tætteste dialog. Vi lytter omhyggeligt og vi vil forbedre Rise of Legions, baseret på, hvad vores fællesskab ønsker mest!";"Om du har några problem eller feedback, använd ""Feedback""-knappen vid stäng dialogrutan. Vi lyssnar uppmärksamt och kommer att förbättra Rise of Legions baserat på vad vår gemenskap vill mest!";"";"Jeśli masz jakieś problemy lub uwagi, użyj przycisku „Feedback” w zamkniętym oknie dialogowym. Słuchamy uważnie i poprawiamy Rise of Legions w oparciu o to, czego najbardziej pragnie nasza społeczność!";"";"Caso encontre problemas ou queira dar seu feedback, utilize o botão ""Feedback"" ao fechar este diálogo. Estamos ouvindo-os cuidadosamente, e iremos aprimorar Rise of Legion baseando-se no que a comunidade mais quer!";"Eğer herhangi bir problem veya geri bildiriminiz varsa, lütfen ""Geri Bildirim"" butonunu kullanarak bize bildiriniz. Geri bildirimlerinizi yakından takip etmekle beraber, Rise of Legions'ı topluluğun istekleri doğrultusunda geliştireceğiz!";"Ако имате някакви проблеми или идей, моля, използвайте бутона ""Feedback"" в края. Ние ви слушаме внимателно, и ще подобрим Rise of Legions в интереса на това, което нашата общност иска най-много!";"Pokud máš nějaký problém, nebo návrh, buď tak laskav a využij ""Feedback"" tlačítko při vypínání. Nasloucháme a vylepšíme Rise of Legions dle toho co si naše komunita přeje nejvíc!";"Αν έχεις κάποιο πρόβλημα ή σχόλιο, παρακαλούμε χρησιμοποίησε το κουμπί «Σχόλια» κατά την έξοδο. Ακούμε προσεκτικά την κοινότητα και θα βελτιώσουμε το παιχνίδι βάσει των επιθυμιών της!";"";"";"Dacă aveți probleme sau propuneri, vă rugăm să utilizați butonul „Propuneri” la dialogul de închidere. Ascultăm îndeaproape și vom îmbunătăți Rise of Legions pe baza a ceea ce comunitatea noastră dorește cel mai mult!";"Si tiene algún problema o comentario, utilice el botón ""Comentarios"" en el cuadro de diálogo de cierre. ¡Escuchamos atentamente y mejoraremos Rise of Legions en función de lo que nuestra comunidad más desea!";"Якщо у вас є якісь проблеми або відгуки, будь ласка, скористайтеся кнопкою ""Зворотній зв'язок"" у діалоговому вікні при закритті гри. Ми уважно слухаємо і покращуємо Rise of Legions, виходячи з того, що найбільше хоче наша спільнота!";"";"若您有任何疑问或是反馈，请点击关闭对话框中的 ""回馈"" 按钮。 我们很愿意听取并根据社群最想要的来改进 Rise of Legions！";"若你有任何疑問或是反饋，請點擊關閉對話框中的 ""回饋"" 按鈕。 我們很願意聽取並根據社群最想要的來改進 Rise of Legions！";"";"문제나 피드백이 있다면, 오른쪽 위에 게임 창 닫기 버튼을 누르고 '피드백' 버튼을 사용하세요. 저희는 언제나 사용자 의견을 주의 깊게 듣고 커뮤니티가 가장 원하는 것을 바탕으로 Rise of Legions를 개선하고 있습니다!";"";""
"home_steam_forum_text";"Klicke hier um unser Steam Forum zu besuchen";"Click here to visit Steam Forums";"Cliquez ici pour visiter les forums de Steam";"Clica aqui para visitar o Forum Steam";"Нажмите здесь, чтобы посетить форумы Steam";"Haga clic aquí para visitar los foros de Steam.";"Clicca qui per visitare i Forum di Steam";"Klik her for at besøge Steam-forum";"Klicka här för att besöka Steam-forums";"";"Naciśnij tutaj aby odwiedzić Forum Steam";"";"Clique aqui para visitar o fórum no Steam";"Steam forumlarını ziyaret etmek için buraya tıklayınız";"Щракнете тук, за да посетите Steam Форуми";"Klikni sem pro Steam Fórum";"Κλίκαρε εδώ για να επισκεφτείς τα Φόρουμ Steam";"";"";"Faceți clic aici pentru a vizita Forumul de pe Steam";"Haz clic aquí para visitar los Foros de Steam";"Натисніть тут, щоб відвідати форуми Steam";"";"请点击此处前往 Steam Forums";"請點擊此處前往 Steam Forums";"";"스팀 포럼에 방문하려면 여기를 클릭하세요";"";""
"home_translation_unfinished_text";"Deine gewählte Sprache ist zu %s übersetzt.\nBitte hilf uns das Spiel komplett zu übersetzen!";"Your chosen language is %s translated.\nPlease help us to fully translate the game!";"La langue que vous avez choisie est %s.\nAidez-nous à traduire entièrement le jeu!";"A linguagem escolhida é %s traduzida.\nPor favor ajude-nos a traduzir o jogo inteiro!";"Выбранный вами язык переведён на %s.\nПожалуйста, помогите нам полностью перевести игру!";"El idioma elegido esta %s traducido.\nPor favor ayúdanos a traducir completamente el juego!";"Il linguaggio selezionato è tradotto al %s.\nPerfavore, aiutaci a tradurre del tutto questo gioco!";"Dit valgte sprog, er %s oversat.\nHjælp os med at oversætte spillet!";"Ditt valda språk är %s översatt.\nVar god hjälp oss översätta hela spelet!";"";"Wybrany przez Ciebie język jest przetłumaczony w %s. \n Prosimy byś pomógł w pełnym przetłumaczeniu gry!";"";"O idioma de sua escolha está %s traduzido.\nPor favor, nos ajude a terminá-lo!";"Seçilmiş olan diliniz %s çevirilmiştir.\nLütfen oyunu tamamen çevirmemize yardım edin!";"";"Vámi vybraný jazyk je z %s přeložený.\nPomozte nám přeložit celou hru!";"Η επιλεγμένη γλώσσα είναι %s μεταφρασμένη.\nΒοηθήστε μας να μεταφράσουμε πλήρως το παιχνίδι!";"Az általad kiválasztott nyelv %s-ig van lefordítva.\nSegíts nekünk teljesen lefordítani a játékot!";"";"Limba aleasă este in proportie de %s tradusă.\nVă rugăm să ne ajutați să traducem complet jocul!";"";"Вибарана вами мова перекладена на %s.\nБудь ласка допоможіть нам повністю перекласти гру!";"";"你所选择的语系目前翻译进度 %s 已翻译。\n请多帮助我们完成此游戏的翻译！";"你所選擇的語系目前翻譯進度 %s 已翻譯。\n請多幫助我們完成此遊戲的翻譯！";"";"선택한 언어는 %s만큼 번역되었습니다.\n게임을 완전히 번역할 수 있도록 도와주세요!";"";""
"home_steam_chat_text";"Klicke hier, um unserer globalen Chat-Gruppe beizutreten";"Click here to join our global chat group";"Cliquez ici pour rejoindre notre groupe de discussion mondial";"Carrega aqui para te juntares ao nosso chat de grupo global";"Нажмите здесь, чтобы присоединиться к нашему глобальному чату";"Haz click aquí para unirte a nuestro chat global";"Clicca qui per unirti alla nostra chat globale";"Klik her for at slutte dig til vores globale chatgruppe";"Klicka här för att gå med i vår globala chattgrupp";"Klik hier om lid te worden van onze wereldwijde chat-groep";"Kliknij tutaj, aby dołączyć do grupy czatu globalnego";"";"Clique aqui, para se juntar ao nosso chat global";"Küresel sohbet grubumuza katılmak için buraya tıkla";"";"Klikni zde pro skupinový chat";"Κλίκαρε εδώ, για να συμμετάσχεις στο παγκόσμιο γκρουπ συνομιλιών";"";"";"Faceți clic aici pentru a vă alătura grupului nostru de chat global";"";"Натисніть тут, щоб приєднатися до нашого глобального чату";"";"请点击此处加入我们的全球聊天群组";"請點擊此處加入我們的全球聊天群組";"";"글로벌 채팅 그룹에 참여하려면 여기를 클릭하세요";"";""
